{
  "session_id": "11111111-1111-4111-8111-111111111111",
  "research_question": "How does sparse attention in transformer models affect long-document summarisation quality versus computational cost?",
  "target_venue": "neurips",
  "citation_style": "nature",
  "max_refinement_iters": 3,
  "budget_usd": 8.0,
  "ethics_flags": [],
  "refinement_policy": {
    "plateau_threshold": 1.0,
    "plateau_window": 2,
    "revert_on_decrease": true
  }
}
